{
  "schema_version": "1.0",
  "sensitivity": "sensitive",
  "resume_text": "职位：高级平台工程师\n技能：Go、Kubernetes、Terraform、Prometheus\n经历：负责 example.com 合成云平台的容器编排与可观测性建设。\n成果：将合成服务发布耗时降低 40%，并为 8 人团队建立故障演练流程。",
  "jd_text": "岗位：高级平台工程师\n职责：建设云平台、容器编排和可观测性能力。\n任职要求：\n- 必须具备 Go 服务开发经验\n- 熟悉 Kubernetes 集群运维\n- 具备 Terraform 基础设施即代码经验\n- 能够推动跨团队故障复盘"
}
